{
  "schema": "agent-workflow-benchmark/abc-adjudication-module/v1",
  "module_id": "routing-semantic-v1-oracle",
  "module_version": "1.0.0",
  "task": {
    "study_id": "routing-semantic-v1",
    "dataset_version": "routing-semantic-corpus-v1.0.0",
    "protocol_version": "routing-semantic-oracle-v1.0.0",
    "description": "Produce an independent blinded A/B/C oracle for the three Agent-Workflow routing semantic seams before live comparative inference."
  },
  "runtime": {
    "kind": "oci-docker",
    "dockerfile": "docker/adjudication/Dockerfile",
    "image": "agent-workflow-oracle-adjudicator:local",
    "agent": {
      "kind": "codex-cli",
      "package": "@openai/codex",
      "version": "0.156.1",
      "entrypoint": "/usr/local/bin/aw-adjudicate",
      "config_mount": "/run/adjudication/config.toml"
    },
    "network": {
      "required": true,
      "purpose": "Reach only the configured Codex model provider/load balancer; no web-search capability is granted to the adjudicator.",
      "docker_network_env": "ADJUDICATION_DOCKER_NETWORK"
    }
  },
  "prompt": {
    "template": "docker/adjudication/START_PROMPT.template.md",
    "target": "/input/START_PROMPT.md",
    "variables": ["ADJUDICATOR_ID"]
  },
  "required_files": [
    {
      "id": "oracle-view",
      "source_repo": "agent-workflow-comparative-eval",
      "source_path": "docs/studies/artifacts/routing-semantic-v1/oracle-authoring-view.json",
      "target": "/input/oracle-view.json",
      "sha256": "a5a40224793a50d9371e9ae437e144b15812829ba1cd56a5564dc6ba28846a0a",
      "roles": ["A", "B", "coordinator"],
      "read_only": true
    },
    {
      "id": "oracle-protocol",
      "source_repo": "agent-workflow-comparative-eval",
      "source_path": "docs/studies/routing-semantic-v1-oracle-protocol.md",
      "target": "/input/oracle-protocol.md",
      "sha256": null,
      "roles": ["A", "B", "C", "coordinator"],
      "read_only": true
    },
    {
      "id": "routing-corpus",
      "source_repo": "agent-workflow-comparative-eval",
      "source_path": "src/agent_workflow_comparative_eval/resources/studies/routing-semantic-v1.corpus.json",
      "target": "coordinator/routing-corpus.json",
      "sha256": "e4b33df3b3752b32cdb362833765cc8f0c9cc024473071209563d73284011280",
      "roles": ["coordinator"],
      "read_only": true
    }
  ],
  "roles": {
    "primary": [
      {
        "role": "A",
        "adjudicator_id": "codex-a",
        "result_subdir": "a/output"
      },
      {
        "role": "B",
        "adjudicator_id": "codex-b",
        "result_subdir": "b/output"
      }
    ],
    "tiebreaker": {
      "role": "C",
      "adjudicator_id": "codex-c",
      "result_subdir": "c/output",
      "trigger": "ab-disagreement-only",
      "input_policy": "disputed-cases-and-seams-only"
    }
  },
  "credentials": {
    "mode": "external-env-file",
    "allow_names": [],
    "deny_prefixes": ["TYPESAFE_"],
    "secret_values_in_manifests": false
  },
  "guardrails": {
    "repository_mounted": false,
    "docker_socket_mounted": false,
    "root_filesystem_read_only": true,
    "cap_drop": ["ALL"],
    "no_new_privileges": true,
    "agent_sandbox": "read-only",
    "web_search": false,
    "cross_agent_visibility": false,
    "treatment_outputs_visible": false,
    "other_adjudicator_labels_visible": false,
    "overwrite_completed_results": false
  },
  "output": {
    "model_schema_generator": "scripts/prepare-docker-oracle-adjudication.py",
    "pass_schema": "agent-workflow-benchmark/decision-study-adjudication-pass/v1",
    "result_filename": "adjudication.json",
    "hash_sidecar": true
  },
  "coordination": {
    "primary_start": "parallel",
    "reveal_policy": "after-all-primary-complete",
    "comparison_command": "agent-workflow benchmark decision-study-oracle-disputes",
    "c_input_artifact": "coordinator/oracle-disputes-for-c.json",
    "resolution_policy": "two-of-three-then-recorded-discussion",
    "unresolved_marker": "oracle_conflict_unresolved",
    "freeze_command": "agent-workflow benchmark decision-study-oracle-freeze",
    "inference_allowed_after": "oracle-freeze-and-validation"
  },
  "results": {
    "runtime_root": ".adjudication/routing-semantic-v1",
    "coordinator_subdir": "coordinator",
    "frozen_result": "coordinator/oracle.json",
    "freeze_manifest": "coordinator/oracle.json.manifest.json",
    "final_validation": "coordinator/final-validation.json"
  }
}
